category	label	description	recognized_by	remark
self	controllable	The agent's avatar; the object its GameMoves move (the grounded self).	has(controllable)	builtin prior 役. controllable Word = §4 behavior modifier / FR-168 grounded pick; detection lives in words.tsv.
referent	target	The goal object the controllable must reach/match; the destination the Goal predicate reads.	or(has(marked), and(has(box), inside(self, box)))	builtin prior 役. references Words: marked (a salient/goal-marker feature) + box (shape head-noun §3); both detected in words.tsv. has(box) makes the box-shape constraint REAL (the candidate must be box-shaped, not just any bbox-enclosing object), inside(self, box) keeps the controllable inside the candidate. inside via Relation operator.
self	held-state	State the controllable carries that must match the target (e.g. orientation/form held by the avatar).	has(pose-mutable)	builtin prior 役. pose-mutable = a behavior Word (orientation/form changes on MOVE, carried with self); detection lives in words.tsv.
cause	interactor	An object that, on contact, drives a typed effect on another object (deterministic remote interaction; ls20 marker).	has(interactive)	builtin prior 役. interactive = behavior Word backed by EffectSignature (drives a Relation/effect on the status-object, not on self); detection lives in words.tsv.
ground	field	Background / ground; the static field plane objects sit on.	or(has(background), has(static))	builtin prior 役. background (isField per-object field flag) and static (§4 no-dynamics modifier) are Words detected in words.tsv.
referent	status-object	Status object: a target_type whose attribute the win predicate reads; changes by remote interaction, not moved by the agent (verbalization §5b).	and(has(interactive-target), not(has(controllable)))	builtin prior 役. interactive-target = is the OBJ side of an interactor's EffectSignature (recolored/cycled remotely); detection lives in words.tsv. (See-also §5.2 status-object.)
referent	hazard	A deadly object/region the controllable must avoid: contact (a move-into or a click) transitions the game to GAME_OVER. The win/safety predicate references it as the object to keep away from (the avoided referent behind gp-avoid-target).	and(has(lethal), not(has(controllable)))	EXPRESSIBLE with words+operators only: lethal (behavior Word) + and/not/has (operators.md). Distinct from target (the destination to REACH/MATCH) and from template (a read-only SOURCE) — hazard is the object to AVOID. MOTIVATED by tu93/bp35/wa30/sp80/su15 (death-on-contact, verified state->GAME_OVER after a move/click onto these cells). CONFIDENCE medium-high: the death signal is unambiguous, but the lethal DETECTOR is pending so the recognizer is vocabulary-ready not yet emitted. Canon alignment: survive-hazard goal_kind, danger_map/reachability_timed_denial/pursuit_evasion solvers, and gp-avoid-target's remark ('hazard-avoidance') already use 'hazard'. MERGE NOTE: gp-avoid-target's predicate not(overlaps(controllable, target)) currently reads `target` for the AVOIDED object (a role mis-use); on merge it should read `hazard` instead, rather than shipping a sibling pattern (MECE: one pattern per archetype). Recognizer depends on the lethal Word loading first (AssetLoader loads words before roles). WAVE PLACEMENT: hazard is category=referent, so AnalogizeRoles places it in the relational Wave C (by category, not by self-mention — its recognizer names no self). target out-ranks it within Wave C by row order (target row 3 precedes hazard), so a lethal+target object resolves to target, never stolen by hazard. The earlier Wave-B pre-emption is fixed (B1 category-aware classifier); test_lethal_target_is_target_not_hazard pins it.
referent	template	A reference/template object the agent must reproduce elsewhere: a salient pattern shown on the board that target region(s) must come to match (the SOURCE of a copy/mirror/transfer).	and(has(marked), not(has(controllable)))	EXPRESSIBLE with existing words+operators only: marked (salient feature, words.tsv) + and/not/has (operators.md). Distinct from target (the destination that must change) and from status-object (driven by an interactor) — template is read-only SOURCE, target is the WRITTEN destination. CONSERVATIVE recognizer: salient AND not-the-avatar. MOTIVATED by tu93/sc25/vc33/m0r0 (a template region/object is shown and the human reproduces it). CONFIDENCE medium: the marked/not-controllable recognizer cannot by itself disambiguate reference from target when both are marked; a stronger recognizer needs a SOURCE-vs-DESTINATION (read-only vs written) distinction = needs an operator/word not in the 14 (backlog: source/destination operator). marked DETECTOR pending so the recognizer is vocabulary-ready not yet emitted. WAVE PLACEMENT: template is category=referent, so AnalogizeRoles places it in the relational Wave C BY CATEGORY (its recognizer names no self). target out-ranks it within Wave C by row order (target row 3 precedes template), so a marked box resolves to target, never stolen by template; test_referent_role_never_preempts_target pins it.
